Атрибут,Герой,Damage,CпособностиСила,Abaddon,33,"Quas, Wex, Exort"Сила,Alchemist,46,"Borrowed Time, Metamorphosis, Закончить Nightmare"Сила,Axe,47,"Battle Trance, Telekinesis Land, Fade Bolt"Сила,Beastmaster,37,"Sun Ray, Berserker's Rage, Whirling Axes (дальний бой)"Сила,Brewmaster,51,"Sanity's Eclipse, Icarus Dive, Fire Spirits"Сила,Bristleback,57,"Arcane Orb, Astral Imprisonment, Essence Aura"Сила,CentaurWarrunner,63,"Flamebreak, Firefly, Flaming Lasso"Сила,ChaosKnight,48,"Essence Shift, Shadow Dance, Sticky Napalm"Сила,Clockwerk,35,"Laguna Blade, Dark Pact, Pounce"Сила,Dawnbreaker,47,"Dragon Slave, Light Strike Array, Fiery Soul"Сила,Doom,45,"Powershot, Windrun, Focus Fire"Сила,DragonKnight,43,"Rip Tide, Song of the Siren, Shackleshot"Сила,EarthSpirit,51,"Nether Swap, Mirror Image, Ensnare"Сила,Earthshaker,61,"Magic Missile, Wave of Terror, Vengeance Aura"Сила,ElderTitan,50,"Call of the Wild, Inner Beast, Primal Roar"Сила,Huskar,58,"X Marks the Spot, Ghostship, Wild Axes"Сила,Io,33,"Summon Familiars, Torrent, Tidebringer"Сила,Kunkka,46,"Grave Chill, Soul Assumption, Gravekeeper's Cloak"Сила,LegionCommander,30,"Disruption, Soul Catcher, Shadow Poison"Сила,Lifestealer,60,"Forge Spirit, Ice Wall, Deafening Blast"Сила,Lycan,67,"Alacrity, Chaos Meteor, Sun Strike"Сила,Magnus,69,"Ghost Walk, Tornado, EMP"Сила,Marci,43,"Chilling Touch, Ice Blast, Cold Snap"Сила,Mars,41,"Wall of Replica, Cold Feet, Ice Vortex"Сила,NightStalker,34,"Vacuum, Ion Shell, Surge"Сила,Omniknight,69,"Diabolic Edict, Lightning Storm, Pulse Nova"Сила,Phoenix,66,"Shadow Wave, Weave, Split Earth"Сила,Pudge,45,"Life Drain, Poison Touch, Shallow Grave"Сила,SandKing,66,"Nether Blast, Decrepify, Nether Ward"Сила,Slardar,34,"Silence, Witchcraft, Exorcism"Сила,Snapfire,33,"Scream Of Pain, Sonic Wave, Crypt Swarm"Сила,SpiritBreaker,32,"Chaotic Offering, Shadow Strike, Blink"Сила,Sven,61,"Fatal Bonds, Shadow Word, Upheaval"Сила,Tidehunter,67,"Heartstopper Aura, Sadist, Reaper's Scythe"Сила,Timbersaw,68,"Midnight Pulse, Black Hole, Death Pulse"Сила,Tiny,68,"Death Ward, Malefice, Demonic Conversion"Сила,TreantProtector,44,"Paralyzing Cask, Voodoo Restoration, Maledict"Сила,Tusk,51,"Hex, Mana Drain, Finger of Death"Сила,Underlord,40,"Sacrifice, Chain Frost, Earth Spike"Сила,Undying,64,"Fiend's Grip, Frost Blast, Ice Armor"Сила,WraithKing,40,"Enfeeble, Brain Sap, Nightmare"Ловкость,Anti-Mage,34,"Reflection, Conjure Image, Sunder"Ловкость,ArcWarden,38,"Mystic Snake, Mana Shield, Stone Gaze"Ловкость,Bloodseeker,52,"Spiked Carapace, Vendetta, Split Shot"Ловкость,BountyHunter,60,"Divided We Stand, Impale, Mana Burn"Ловкость,Broodmother,55,"Earthbind, Poof, Geostrike"Ловкость,Clinkz,65,"Dispersion, Reality, Haunt"Ловкость,DrowRanger,56,"Time Lapse, Spectral Dagger, Desolate"Ловкость,EmberSpirit,41,"The Swarm, Shukuchi, Geminate Attack"Ловкость,FacelessVoid,47,"Spin Web, Incapacitating Bite, Insatiable Hunger"Ловкость,Gyrocopter,42,"Skeleton Walk, Death Pact, Spawn Spiderlings"Ловкость,Hoodwink,44,"Viper Strike, Strafe, Searing Arrows"Ловкость,Juggernaut,45,"Poison Attack, Nethertoxin, Corrosive Skin"Ловкость,LoneDruid,52,"Phantom Strike, Blur, Coup de Grace"Ловкость,Luna,50,"Time Lock, Chronosphere, Stifling Dagger"Ловкость,Medusa,44,"Poison Nova, Time Walk, Backtrack"Ловкость,Meepo,44,"Venomous Gale, Poison Sting, Plague Ward"Ловкость,Mirana,51,"Static Link, Unstable Current, Eye of the Storm"Ловкость,MonkeyKing,59,"Presence of the Dark Lord, Requiem of Souls, Plasma Field"Ловкость,Morphling,64,"Rupture, Shadowraze, Necromastery"Ловкость,NagaSiren,42,"Bloodrage, Blood Bath, Thirst"Ловкость,NyxAssassin,40,"Empower, Skewer, Reverse Polarity"Ловкость,Pangolier,52,"Tombstone, Flesh Golem, Shockwave"Ловкость,PhantomAssassin,30,"Phantasm, Decay, Soul Rip"Ловкость,PhantomLancer,45,"Chaos Bolt, Reality Rift, Chaos Strike"Ловкость,Razor,36,"Howl, Feral Impulse, Shapeshift"Ловкость,Riki,30,"Greater Bash, Nether Strike, Summon Wolves"Ловкость,ShadowFiend,54,"Doom, Charge of Darkness, Empowering Haste"Ловкость,Slark,67,"Devour, Scorched Earth, LVL? Death"Ловкость,Sniper,36,"Crippling Fear, Hunter in the Night, Darkness"Ловкость,Spectre,67,"Open Wounds, Infest, Void"Ловкость,TemplarAssassin,55,"Reincarnation, Rage, Feast"Ловкость,Terrorblade,50,"Wraithfire Blast, Vampiric Aura, Mortal Strike"Ловкость,TrollWarlord,39,"Kraken Shell, Anchor Smash, Ravage"Ловкость,Ursa,48,"Bash, Amplify Damage, Gush"Ловкость,VengefulSpirit,68,"Epicenter, Sprint, Slithereen Crush"Ловкость,Venomancer,45,"Burrowstrike, Sand Storm, Caustic Finale"Ловкость,Viper,49,"Rot, Flesh Heap, Dismember"Ловкость,Weaver,53,"Counter Helix, Culling Blade, Meat Hook"Интеллект,AncientApparition,31,"Spirit Form, Berserker's Call, Battle Hunger"Интеллект,Bane,32,"Chakra Magic, Recall, Blinding Light"Интеллект,Batrider,40,"Static Storm, Illuminate, Mana Leak"Интеллект,Chen,30,"Thunder Strike, Glimpse, Kinetic Field"Интеллект,CrystalMaiden,39,"Telekinesis, Null Field, Spell Steal"Интеллект,DarkSeer,61,"Bloodlust, Unrefined Fireblast, Multicast"Интеллект,DarkWillow,42,"Global Silence, Fireblast, Ignite"Интеллект,Dazzle,62,"Curse of the Silent, Glaives of Wisdom, Last Word"Интеллект,DeathProphet,58,"Penitence, Test of Faith, Hand of God"Интеллект,Disruptor,50,"Ice Path, Liquid Fire, Macropyre"Интеллект,Enchantress,54,"Nature's Attendants, Impetus, Dual Breath"Интеллект,Enigma,35,"Wrath of Nature, Untouchable, Enchant"Интеллект,Grimstroke,59,"Sprout, Teleportation, Nature's Call"Интеллект,Invoker,69,"Heat-Seeking Missile, March of the Machines, Rearm"Интеллект,Jakiro,55,"Shackles, Mass Serpent Ward, Laser"Интеллект,KeeperoftheLight,67,"Thundergod's Wrath, Ether Shock, Hex"Интеллект,Leshrac,49,"Arc Lightning, Lightning Bolt, Static Field"Интеллект,Lich,39,"Electric Vortex, Overload, Ball Lightning"Интеллект,Lina,41,"Waning Rift, Phase Shift, Static Remnant"Интеллект,Lion,65,"Arcane Aura, Freezing Field, Illusory Orb"Интеллект,Nature'sProphet,63,"True Form, Crystal Nova, Frostbite"Интеллект,Necrophos,52,"Rabid, Synergy, Battle Cry"Интеллект,OgreMagi,39,"Flak Cannon, Call Down, Summon Spirit Bear"Интеллект,Oracle,59,"Enrage, Rocket Barrage, Homing Missile"Интеллект,OutworldDestroyer,67,"Earthshock, Overpower, Fury Swipes"Интеллект,Puck,65,"Jinada, Shadow Walk, Track"Интеллект,Pugna,50,"Lunar Blessing, Eclipse, Shuriken Toss"Интеллект,QueenofPain,55,"Psi Blades, Lucent Beam, Moon Glaive"Интеллект,Rubick,50,"Assassinate, Refraction, Meld"Интеллект,ShadowDemon,39,"Shrapnel, Headshot, Take Aim"Интеллект,ShadowShaman,40,"Blink Strike, Backstab, Permanent Invisibility"Интеллект,Silencer,59,"Juxtapose, Phantom Edge, Smoke Screen"Интеллект,SkywrathMage,34,"Replicate, Spirit Lance, Doppelwalk"Интеллект,StormSpirit,67,"Adaptive Strike, Morph (Agility Gain), Morph (Strength Gain)"Интеллект,Techies,34,"Leap, Moonlight Shadow, Waveform"Интеллект,Tinker,66,"Omnislash, Starstorm, Sacred Arrow"Интеллект,Visage,46,"Blade Fury, Healing Ward, Blade Dance"Интеллект,VoidSpirit,52,"Gust, Precision Aura, Marksmanship"Интеллект,Warlock,66,"Spell Shield, Mana Void, Frost Arrows"Интеллект,Windranger,49,"Toggle Movement, Mana Break, Blink"Интеллект,WinterWyvern,36,"Launch Fire Spirit, Stop Icarus Dive, Stop Sun Ray"Интеллект,WitchDoctor,66,"Rolling Boulder, Geomagnetic Grip, Supernova"Интеллект,Zeus,42,"Moment of Courage, Duel, Boulder Smash"